<?xml version="1.0" encoding="UTF-8"?>
<NormalizedMessage xmlns="http://globalgateway.mycorelogic.com/NormalizedMessage" xsi:noNamespaceSchemaLocation="../Schemas/NormalizedMessage.xsd" xmlns:g2="http://globalgateway.mycorelogic.com/ServiceConfiguration" xmlns:xsi="http://www.w3.org/2001/XMLSchema-instance">
	<requestType>TAX-SSOT</requestType>
	<requestAction>Submit</requestAction>
	<payload>PAYLOAD GOES HERE</payload>
	<safeStoreFilename>Safestore File Name Goes Here</safeStoreFilename>
	<postBackURL>Post Back URL Goes Here</postBackURL>
	<orderId></orderId>
	<partnerId>WELLS_FARGO-LG</partnerId>
</NormalizedMessage>
